question,document
"If I set up Module 2 in a different codespace, can I delete it later without losing my work?",1e829a8c6f
Do I have to commit my Module 2 changes before I close or remove the codespace?,1e829a8c6f
Why do I keep getting `JSONDecodeError: Expecting value` when I try to parse the LLM output for ground-truth questions?,a3c7e1b4f9
How can I make the model return valid JSON instead of putting the answer inside a code block or adding extra text?,a3c7e1b4f9
What should I change in my OpenAI call so `json.loads(...)` works without failing on the first character?,a3c7e1b4f9
"Do I need to specify the exact JSON shape in the prompt, and if so, what should it say?",a3c7e1b4f9
Is there a provider-specific way to force JSON output in tools like Gemini or Groq?,a3c7e1b4f9
Why does my Jupyter notebook kernel crash when I try to embed the ground-truth data?,b8f2d6a30c
What can I do if embedding the ground-truth set uses too much RAM on Codespaces or my laptop?,b8f2d6a30c
Is there a smaller sentence-transformers model I can use instead of the default embedder?,b8f2d6a30c
How do I avoid memory issues by running the embedding step outside the notebook?,b8f2d6a30c
Can I batch the ground-truth embeddings and free memory between chunks to stop the crash?,b8f2d6a30c
Why does adding a small sleep in my loop still hit Gemini limits when I’m building the ground-truth data?,c1e9f4b820
What should I do if the free Gemini quota gets exhausted halfway through a long tqdm run?,c1e9f4b820
Is it better to switch to GPT-4o mini or Groq if I keep running into rate limits during evaluation dataset generation?,c1e9f4b820
How can I reduce the chance of hitting API rate limits when I’m using thread pools for this task?,c1e9f4b820
What’s a good way to avoid losing progress if the model request limit stops my ground-truth generation job?,c1e9f4b820
How do I fix the Windows error about loading torch\lib\fbgemm.dll or one of its dependencies?,15e931476c
I’m getting OSError: [WinError 126] on Windows when importing PyTorch — what should I install to solve it?,15e931476c
What can I do if Python says it can’t find fbgemm.dll in my Torch site-packages folder on Windows?,15e931476c
Do I need Visual C++ Redistributable for the fbgemm.dll missing module error in PyTorch?,15e931476c
"Is Visual Studio required for the WinError 126 fbgemm.dll issue, or is Visual Studio Code enough?",15e931476c
"Why do I get ""could not translate host name postgres to address"" when I run prep.py, and what should I change in my .env file?",4b65d5542d
"I’m seeing a psycopg2 OperationalError about the host ""postgres"" not being found. How do I fix the database connection?",4b65d5542d
What is the correct value for POSTGRES_HOST if python prep.py fails with a No such host is known error?,4b65d5542d
"My prep.py script throws an OperationalError with host name postgres. Do I need to edit .env, and if so what line?",4b65d5542d
How can I solve the postgres host resolution error in Module 5 Monitoring when running the prep script?,4b65d5542d
How do I make Pandas stop cutting off long text in a column and show the full content?,641aedbbf5
"In the offline-rag-evaluation notebook, how can I see the whole Explanation text from the judge LLM instead of a truncated version?",641aedbbf5
What Pandas setting should I change if a column only shows the first 50 characters with dots at the end?,641aedbbf5
"How can I display the entire content of a text column in Pandas, not just a shortened preview?",641aedbbf5
Is there a quick way to let Pandas show unlimited column width for long strings?,641aedbbf5
How do I normalize vectors stored in a pandas DataFrame column?,5039707c1a
What's the easiest way to normalize each vector in a Pandas Series?,5039707c1a
Can I use apply with numpy.linalg.norm to normalize a column of vectors in pandas?,5039707c1a
How would I create a new DataFrame column with normalized vectors from an existing one?,5039707c1a
What’s the standard way to divide each vector by its norm in a pandas column?,5039707c1a
How can I get the 75th percentile for a column in a Pandas DataFrame?,b4c8ac5a0c
What’s the Pandas way to calculate the 0.75 quantile of a Series?,b4c8ac5a0c
How do I compute a percentile value for one DataFrame column in pandas?,b4c8ac5a0c
Is there a simple `.quantile()` example for the 75% point in Pandas?,b4c8ac5a0c
How can I find the 75 percentile from a dataframe column with Pandas?,b4c8ac5a0c
"How do I wipe all Docker containers from the terminal, including the ones still running?",66ccbb7da0
What's the command to force-remove every Docker image on my machine?,66ccbb7da0
How can I delete all Docker volumes using just the command line?,66ccbb7da0
Is there a quick way to clean up all containers and images in Docker at once?,66ccbb7da0
"Which terminal commands should I run to fully clear Docker containers, images, and volumes?",66ccbb7da0
"How do I make Streamlit feedback buttons only work once per submission, like one +1 or -1 per answer?",2e729f1271
Why does my `st.session.submitted` flag keep getting set back to True after I press a feedback button?,2e729f1271
"In Streamlit, what’s the best way to disable the feedback buttons when `st.session.submitted` is False after hitting Ask?",2e729f1271
I’m trying to stop users from clicking feedback more than once on the same submission — how do I fix the session state issue?,2e729f1271
Where can I find the solution for Streamlit session attributes being reassigned unexpectedly in this feedback-button setup?,2e729f1271
"Why do I get ""streamlit: executable file not found in $PATH"" when starting my app with docker-compose, even though it works normally?",e8df9f0d12
What should I check in my Docker setup if docker-compose fails to launch a Streamlit app with that OCI runtime error?,e8df9f0d12
Do I need to add a Dockerfile and install Streamlit differently for docker-compose to run my app?,e8df9f0d12
"After changing my compose setup for Streamlit, what command should I run to rebuild everything and start it again?",e8df9f0d12
How can I fix the container startup error where docker says it can't find the streamlit executable?,e8df9f0d12
"Can the capstone be done as a team project, or does every student need to submit their own work?",0fab61eca2
"If we brainstorm or build something together, is that still okay for the capstone?",0fab61eca2
Could multiple students share one system if each person owns a separate part of it?,0fab61eca2
What counts as an independent capstone submission when people collaborate on the same idea?,0fab61eca2
"If the project can't be graded separately for each person, is that allowed for the capstone?",0fab61eca2
"Do I need to hand in two separate capstone projects, or is one project enough for the course?",d5fc98925d
"What exactly do attempt 1 and attempt 2 mean for the capstone submission, and do I have to submit again if the first try fails?",d5fc98925d
"If I miss the first submission window, can I still submit later in the second window and stay on track?",d5fc98925d
"Can I turn in two projects just for practice, and if so, do they need to be on different datasets and problems?",d5fc98925d
Does a project submission count toward certification if I don’t do the required peer reviews for three classmates?,d5fc98925d
"Is the competition accepted as the capstone project, or is the capstone supposed to be done separately?",e892d44e42
"Can I join the math-kaggle-llm-competition with other students, or do I have to work alone?",e892d44e42
"If I make a team for the competition, does that count toward my capstone requirement?",e892d44e42
"Are capstone submissions individual only, even if I participate in the competition as a group?",e892d44e42
Should I treat the competition and the capstone as two different things in this course?,e892d44e42
How will my capstone project be graded at the end of the course?,9a2e2d2008
"Who reviews the capstone submission, and are they other students too?",9a2e2d2008
"Do I also need to grade other students’ projects, or is it only my own work being reviewed?",9a2e2d2008
What happens if I don’t review the required number of fellow students’ projects?,9a2e2d2008
Is the final capstone score based on one reviewer’s grade or on several peer reviews?,9a2e2d2008
When do we get the projects to review and grade after the deadline?,eae0fb50aa
How are the review assignments distributed to each participant?,eae0fb50aa
Will everyone get the same number of projects for grading in the capstone project?,eae0fb50aa
Is there an Excel sheet with the peer-review assignments after submissions close?,eae0fb50aa
"After the submission deadline, how will I know which 3 projects I need to grade?",eae0fb50aa
"I already sent in my capstone project, so why don’t I see anything to review yet?",a8a7fef016
When do project reviews actually get assigned after the deadline is over?,a8a7fef016
"Can I pick which submitted projects I want to evaluate, or is it random?",a8a7fef016
Is there any way to start reviewing projects before the review list comes out?,a8a7fef016
"I finished my submission, but the review section is empty — is that normal?",a8a7fef016
Where can I find some project ideas or dataset suggestions for the capstone project?,e76a70cde3
Is there a GitHub page with ideas and datasets I can use for the project?,e76a70cde3
What’s the best place to look for dataset options and project inspiration for the capstone?,e76a70cde3
"Do you have a link with tips, guidelines, and possible datasets for the project?",e76a70cde3
Where should I go if I need some ideas to get started on the project?,e76a70cde3
"For the capstone project, is it required to use Airflow, Mage, or Kestra, or is a simple Python script enough?",d4f7c08ea1
Can I still get full points on the ingestion pipeline part if I just write a plain script that loads and indexes the data?,d4f7c08ea1
"If I do the ingestion steps in a Jupyter notebook instead of a script, how many points would that count for?",d4f7c08ea1
"Should I add an orchestration tool to the project just to satisfy the criterion, or only when the use case really needs it?",d4f7c08ea1
"When would it make sense to use an orchestrator in the capstone, like for a dataset that refreshes every day?",d4f7c08ea1
How can I evaluate a recommender-style RAG when I don’t have clear ground-truth answers?,9b0e2d6a47
What’s a good way to create synthetic test queries for each item so I can measure retrieval quality?,9b0e2d6a47
"Is it possible to use an LLM as a judge for end-to-end RAG evaluation, and how would that work?",9b0e2d6a47
"For ranking tasks where several items could be valid, should I use hit rate or NDCG?",9b0e2d6a47
How do I score a RAG system by relevance and usefulness if I have to define the rubric myself?,9b0e2d6a47
"For a big corpus with long PDFs, should I spend time building the perfect chunker first, or just start with something basic and test it?",6f2a8b3d10
What’s a good first chunking setup for long docs if I want to get an initial retrieval baseline fast?,6f2a8b3d10
"If my documents have clear sections, is it worth using an LLM to break them into logical chunks instead of fixed-size pieces?",6f2a8b3d10
"Does adding a short summary to each chunk actually help search, and how would I use it in indexing?",6f2a8b3d10
"For legal or financial PDFs, should I rely only on dense embeddings, or is a hybrid BM25 plus dense setup better when exact wording matters?",6f2a8b3d10
"What does reproducibility mean for the capstone project, and do reviewers need my API keys?",e5d8a2c761
How should I let someone rebuild the search index from my repo without giving away credentials?,e5d8a2c761
"Should I include a .env.example file in the project, and what should go in it?",e5d8a2c761
How can I make sure reviewers can run my project with their own keys instead of mine?,e5d8a2c761
What do I need to pin or document so my project can be reproduced reliably?,e5d8a2c761
"Do I have to use Python for the homework and capstone, or can I build everything in something like JavaScript, Go, or Rust?",ea815eb858
"If I choose a non-Python stack for the project, what kind of setup instructions do I need to include in the README?",ea815eb858
"Is it okay to submit the final project in another language if I have a good reason, or will that be a problem for review?",ea815eb858
"What does the course expect from me if I use TypeScript, Java, C#, or R instead of Python?",ea815eb858
"How detailed should the install and run steps be so the reviewer can reproduce my project on Windows, macOS, and Linux?",ea815eb858
Where can I look at past LLM Zoomcamp capstone projects to get an idea of what people built?,930286278d
Is there a page with previous LLM Zoomcamp project submissions from 2024 and 2025?,930286278d
I’m working on the capstone—where do I find examples of earlier projects and repos?,930286278d
Can you point me to old LLM Zoomcamp projects so I can check the expected scope?,930286278d
Are there links for the 2024 and 2025 LLM Zoomcamp project submissions?,930286278d
Do I have to announce or reserve my capstone project idea before I start?,897a350476
Can I just pick a project topic without telling anyone first?,897a350476
"If I want feedback on my project idea, should I ask in Slack?",897a350476
Is it okay if my capstone is similar to a previous project as long as I build it myself?,897a350476
Where can I check past LLM Zoomcamp projects to get a sense of the expected scope?,897a350476
"Can I reuse the workshop content in my own capstone project, or is it only for the class?",d850a0e7ea
Is it okay to use dlt from this workshop in other projects outside this Zoomcamp?,d850a0e7ea
"Could I apply the workshop stuff to an MLOps Zoomcamp project, or would that be off-limits?",d850a0e7ea
"Since dlt is open source, am I allowed to use the materials and code directly in my own work?",d850a0e7ea
"If I have questions about using the workshop content in a project, should I just ask here?",d850a0e7ea
How do I create a new dlt project for loading files from cloud storage into DuckDB?,6bceeebf04
What command should I run to initialize a filesystem-to-duckdb dlt project?,6bceeebf04
I'm starting a dlt load from cloud data — how do I set up the project first?,6bceeebf04
Is there a quick way to bootstrap a dlt pipeline that reads from the filesystem and writes to DuckDB?,6bceeebf04
Where do I begin if I want to initialize dlt for a cloud file source and DuckDB destination?,6bceeebf04
"Why do I get `Table notion_pages___homework does not exist` when I run `db.open_table(""notion_pages___homework"")`?",0407213397
What should I check if opening `notion_pages___homework` throws a `FileNotFoundError` in the dlt workshop?,0407213397
"I changed the table name to homework, but `db.open_table(""notion_pages___homework"")` still fails — what am I missing?",0407213397
How can I fix the missing table error for `notion_pages___homework` in my pipeline?,0407213397
Is there a setting I forgot to update if the code still looks for `employee_handbook` instead of `homework`?,0407213397
"Why am I getting FileNotFoundError: Table notion_pages___homework does not exist when I run main(), and what should I open instead?",e95bfafc0e
"In the dlt workshop homework, what table name should I use in line 3 so db.open_table works correctly?",e95bfafc0e
"If the error says the table notion_pages___homework doesn't exist, is there a different table I need to open in the code?",e95bfafc0e
"My script fails with ""Please first call db.create_table(...)"" for notion_pages___homework — what exact table should I put in db.open_table?",e95bfafc0e
Where should I change the table reference in the homework code to fix the missing table error?,e95bfafc0e
How can I list all tables in the database with dlt?,e394e6f738
Is there a way to see which tables are already created in the db?,e394e6f738
What method should I call to get the table names from the database?,e394e6f738
How do I check the tables available in my database?,e394e6f738
Can I use db.table_names() to find out what tables exist?,e394e6f738
Does dlt support ClickHouse or StarRocks connectors yet?,cd19f122f3
Are there any built-in connectors in dlt for ClickHouse and StarRocks?,cd19f122f3
"If dlt doesn’t have ClickHouse or StarRocks connectors, can the community add them?",cd19f122f3
Is there a way to contribute a ClickHouse or StarRocks connector to dlt?,cd19f122f3
Why doesn’t dlt include connectors for ClickHouse or StarRocks right now?,cd19f122f3
"Why am I getting a 401 Unauthorized from the Notion search endpoint in the notebook, and how can I fix the secret/access issue?",0dfba07ace
My notebook can’t access Notion and I see a 401 Client Error on api.notion.com/v1/search — what should I check first?,0dfba07ace
"Could this Notion API error be caused by a bad or expired token, and how do I verify that?",0dfba07ace
What permissions or config do I need to confirm when the notebook says it has no secret access to Notion?,0dfba07ace
I keep hitting an authorization error with the Notion API in this workshop; how do I make sure I’m using the right key and endpoint?,0dfba07ace
How do I install the newer requests version from the official source instead of getting 2.28?,4b30b918bc
"Why am I seeing a 401 Client Error when working with this setup, and what should I check?",4b30b918bc
What pip command should I use to force requests v2.32.3 for lancedb?,4b30b918bc
Could this error mean my access key is wrong or not allowed yet?,4b30b918bc
Is there a way to install requests straight from the GitHub release zip?,4b30b918bc
